{
  "artifacts": {
    "f16": {
      "envelopes": [
        {
          "break_even_bps": 10000,
          "conservative_basis": "p50 useful lower envelope; p95 predictor/service/delay/displacement waste upper envelope",
          "eligible": true,
          "hidden_benefit_ns": 175,
          "measurement_basis": {
            "all_observed_spans_exact": true,
            "h2d_flights": 149,
            "h2d_refill_samples": 98,
            "h2d_trace_capacity": 1024,
            "load_mode": "MMAP_BUFFERED",
            "model_sha256": "411c197b503e6fb9199a2b22115e32dc4e2cad803fb112b24967737b3bab26c7",
            "model_size": 784318432,
            "path": "runtime COLD_CACHE scheduler -> exact ExpertStorage read plan -> cold cache -> transfer ring -> hot cache",
            "representative_bundle": {
              "completed_bytes": 786432,
              "expert": 0,
              "layer": 1,
              "spans": [
                {
                  "file_offset": 693343200,
                  "length": 262144
                },
                {
                  "file_offset": 695440352,
                  "length": 262144
                },
                {
                  "file_offset": 697537504,
                  "length": 262144
                }
              ],
              "useful_bytes": 786432
            },
            "scheduler_samples": 149,
            "scheduler_trace_capacity": 256,
            "storage_flights": 149,
            "storage_map_sha256": "42af6acd1d1f2ea77aaa9750b28141670ce69009ba06b5ddca3f42c696b51151",
            "storage_operations": 447,
            "storage_refill_samples": 98,
            "storage_trace_capacity": 1024
          },
          "profile_record": {
            "break_even_bps": 10000,
            "demand_service_ns": 2000,
            "displacement_refill_ns": 681000,
            "h2d_bytes": 0,
            "lead_ns": 2175031,
            "predictor_compute_ns": 1825,
            "readiness": "HOST_READY",
            "scheduler_demand_delay_ns": 478,
            "speculative_service_ns": 2658000,
            "storage_bytes": 786432,
            "transport": "BUFFERED",
            "utility_min_observations": 32,
            "utility_min_timely_successes": 64,
            "utility_window_predictions": 64
          },
          "readiness": "HOST_READY",
          "reason": "eligible",
          "transport": "BUFFERED",
          "waste_cost_ns": 3341303
        },
        {
          "break_even_bps": 7499,
          "conservative_basis": "p50 useful lower envelope; p95 predictor/service/delay/displacement waste upper envelope",
          "eligible": true,
          "hidden_benefit_ns": 2173206,
          "measurement_basis": {
            "all_observed_spans_exact": true,
            "h2d_flights": 149,
            "h2d_refill_samples": 98,
            "h2d_trace_capacity": 1024,
            "load_mode": "DIRECT_IO",
            "model_sha256": "411c197b503e6fb9199a2b22115e32dc4e2cad803fb112b24967737b3bab26c7",
            "model_size": 784318432,
            "path": "runtime COLD_CACHE scheduler -> exact ExpertStorage read plan -> cold cache -> transfer ring -> hot cache",
            "representative_bundle": {
              "completed_bytes": 786432,
              "expert": 0,
              "layer": 1,
              "spans": [
                {
                  "file_offset": 693343200,
                  "length": 262144
                },
                {
                  "file_offset": 695440352,
                  "length": 262144
                },
                {
                  "file_offset": 697537504,
                  "length": 262144
                }
              ],
              "useful_bytes": 786432
            },
            "scheduler_samples": 149,
            "scheduler_trace_capacity": 256,
            "storage_flights": 149,
            "storage_map_sha256": "42af6acd1d1f2ea77aaa9750b28141670ce69009ba06b5ddca3f42c696b51151",
            "storage_operations": 447,
            "storage_refill_samples": 98,
            "storage_trace_capacity": 1024
          },
          "profile_record": {
            "break_even_bps": 7499,
            "demand_service_ns": 3194000,
            "displacement_refill_ns": 3206000,
            "h2d_bytes": 0,
            "lead_ns": 2175031,
            "predictor_compute_ns": 1825,
            "readiness": "HOST_READY",
            "scheduler_demand_delay_ns": 470,
            "speculative_service_ns": 3306000,
            "storage_bytes": 786432,
            "transport": "DIRECT_IO",
            "utility_min_observations": 32,
            "utility_min_timely_successes": 48,
            "utility_window_predictions": 64
          },
          "readiness": "HOST_READY",
          "reason": "eligible",
          "transport": "DIRECT_IO",
          "waste_cost_ns": 6514295
        },
        {
          "break_even_bps": 7028,
          "conservative_basis": "p50 useful lower envelope; p95 predictor/service/delay/displacement waste upper envelope",
          "eligible": true,
          "hidden_benefit_ns": 93175,
          "measurement_basis": {
            "all_observed_spans_exact": true,
            "h2d_flights": 149,
            "h2d_refill_samples": 98,
            "h2d_trace_capacity": 1024,
            "load_mode": "MMAP_BUFFERED",
            "model_sha256": "411c197b503e6fb9199a2b22115e32dc4e2cad803fb112b24967737b3bab26c7",
            "model_size": 784318432,
            "path": "runtime COLD_CACHE scheduler -> exact ExpertStorage read plan -> cold cache -> transfer ring -> hot cache",
            "representative_bundle": {
              "completed_bytes": 786432,
              "expert": 0,
              "layer": 1,
              "spans": [
                {
                  "file_offset": 693343200,
                  "length": 262144
                },
                {
                  "file_offset": 695440352,
                  "length": 262144
                },
                {
                  "file_offset": 697537504,
                  "length": 262144
                }
              ],
              "useful_bytes": 786432
            },
            "scheduler_samples": 149,
            "scheduler_trace_capacity": 256,
            "storage_flights": 149,
            "storage_map_sha256": "42af6acd1d1f2ea77aaa9750b28141670ce69009ba06b5ddca3f42c696b51151",
            "storage_operations": 447,
            "storage_refill_samples": 98,
            "storage_trace_capacity": 1024
          },
          "profile_record": {
            "break_even_bps": 7028,
            "demand_service_ns": 95000,
            "displacement_refill_ns": 109000,
            "h2d_bytes": 786432,
            "lead_ns": 2175031,
            "predictor_compute_ns": 1825,
            "readiness": "DEVICE_READY",
            "scheduler_demand_delay_ns": 478,
            "speculative_service_ns": 109000,
            "storage_bytes": 0,
            "transport": "HOST_TO_DEVICE",
            "utility_min_observations": 32,
            "utility_min_timely_successes": 45,
            "utility_window_predictions": 64
          },
          "readiness": "DEVICE_READY",
          "reason": "eligible",
          "transport": "HOST_TO_DEVICE",
          "waste_cost_ns": 220303
        },
        {
          "break_even_bps": 8226,
          "conservative_basis": "p50 useful lower envelope; p95 predictor/service/delay/displacement waste upper envelope",
          "eligible": true,
          "hidden_benefit_ns": 2173206,
          "measurement_basis": {
            "all_observed_spans_exact": true,
            "h2d_flights": 149,
            "h2d_refill_samples": 98,
            "h2d_trace_capacity": 1024,
            "load_mode": "MMAP_BUFFERED",
            "model_sha256": "411c197b503e6fb9199a2b22115e32dc4e2cad803fb112b24967737b3bab26c7",
            "model_size": 784318432,
            "path": "runtime COLD_CACHE scheduler -> exact ExpertStorage read plan -> cold cache -> transfer ring -> hot cache",
            "representative_bundle": {
              "completed_bytes": 786432,
              "expert": 0,
              "layer": 1,
              "spans": [
                {
                  "file_offset": 693343200,
                  "length": 262144
                },
                {
                  "file_offset": 695440352,
                  "length": 262144
                },
                {
                  "file_offset": 697537504,
                  "length": 262144
                }
              ],
              "useful_bytes": 786432
            },
            "scheduler_samples": 149,
            "scheduler_trace_capacity": 256,
            "storage_flights": 149,
            "storage_map_sha256": "42af6acd1d1f2ea77aaa9750b28141670ce69009ba06b5ddca3f42c696b51151",
            "storage_operations": 447,
            "storage_refill_samples": 98,
            "storage_trace_capacity": 1024
          },
          "profile_record": {
            "break_even_bps": 8226,
            "demand_service_ns": 2877000,
            "displacement_refill_ns": 2939000,
            "h2d_bytes": 786432,
            "lead_ns": 2175031,
            "predictor_compute_ns": 1825,
            "readiness": "DEVICE_READY",
            "scheduler_demand_delay_ns": 478,
            "speculative_service_ns": 7135000,
            "storage_bytes": 786432,
            "transport": "BUFFERED",
            "utility_min_observations": 32,
            "utility_min_timely_successes": 53,
            "utility_window_predictions": 64
          },
          "readiness": "DEVICE_READY",
          "reason": "eligible",
          "transport": "BUFFERED",
          "waste_cost_ns": 10076303
        },
        {
          "break_even_bps": 8144,
          "conservative_basis": "p50 useful lower envelope; p95 predictor/service/delay/displacement waste upper envelope",
          "eligible": true,
          "hidden_benefit_ns": 2173206,